{"$schema":"https://json-schema.org/draft/2020-12/schema","$id":"https://socioprophet.io/schemas/workspace/orggov-control-room.schema.json","title":"OrgGovControlRoom","type":"object","additionalProperties":false,"required":["schemaVersion","controlRoomId","workroomRef","objectiveRefs","workOrderRefs","actorRefs","roleBindingRefs","policyDecisionRefs","assetRefs","actionRefs","evidenceRefs","reviewRefs","outcomeRefs","scorecardRefs","learningEventRefs","panels"],"properties":{"schemaVersion":{"const":"v0.1"},"controlRoomId":{"type":"string"},"workroomRef":{"type":"string"},"objectiveRefs":{"type":"array","items":{"type":"string"}},"workOrderRefs":{"type":"array","items":{"type":"string"}},"actorRefs":{"type":"array","items":{"type":"string"}},"roleBindingRefs":{"type":"array","items":{"type":"string"}},"policyDecisionRefs":{"type":"array","items":{"type":"string"}},"assetRefs":{"type":"array","items":{"type":"string"}},"actionRefs":{"type":"array","items":{"type":"string"}},"evidenceRefs":{"type":"array","items":{"type":"string"}},"reviewRefs":{"type":"array","items":{"type":"string"}},"outcomeRefs":{"type":"array","items":{"type":"string"}},"scorecardRefs":{"type":"array","items":{"type":"string"}},"learningEventRefs":{"type":"array","items":{"type":"string"}},"platformContractRef":{"type":"string"},"ontologyRef":{"type":"string"},"panels":{"type":"array","items":{"type":"object","additionalProperties":false,"required":["panelId","title","kind","sourceRefs"],"properties":{"panelId":{"type":"string"},"title":{"type":"string"},"kind":{"type":"string","enum":["objective","work","actors","policy","assets","actions","evidence","review","score","learning"]},"sourceRefs":{"type":"array","items":{"type":"string"}},"status":{"type":"string"}}}},"labels":{"type":"object","additionalProperties":{"type":"string"}}}}
