{"schemaVersion":"v0.1","controlRoomId":"orggov-control-room-v0","workroomRef":"workroom:orggov-v0","platformContractRef":"github://SocioProphet/prophet-platform/contracts/orggov/orggov-control-plane.v0.1.example.json","ontologyRef":"https://socioprophet.github.io/ontogenesis/domains/institutional-work#","objectiveRefs":["objective:orggov-v0"],"workOrderRefs":["workorder:prophet-platform:406"],"actorRefs":["actor:mdheller","actor:orggov-planning-agent"],"roleBindingRefs":["rolebinding:agent:planner"],"policyDecisionRefs":["policydecision:allow-contract-spine"],"assetRefs":["asset:orggov-contracts"],"actionRefs":["action:create-contract-spine"],"evidenceRefs":["evidence:parent-issue","github://SocioProphet/prophet-platform/pull/409","github://SocioProphet/ontogenesis/pull/43"],"reviewRefs":["review:initial-direction"],"outcomeRefs":["outcome:orggov-captured"],"scorecardRefs":["score:orggov-v0-initial"],"learningEventRefs":["learning:product-compression"],"panels":[{"panelId":"panel-objectives","title":"Objectives and Work Orders","kind":"work","status":"active","sourceRefs":["objective:orggov-v0","workorder:prophet-platform:406"]},{"panelId":"panel-actors","title":"Human and Agent Actors","kind":"actors","status":"active","sourceRefs":["actor:mdheller","actor:orggov-planning-agent","rolebinding:agent:planner"]},{"panelId":"panel-policy","title":"Policy and Authority","kind":"policy","status":"planned","sourceRefs":["policydecision:allow-contract-spine","github://SocioProphet/policy-fabric/issues/57"]},{"panelId":"panel-evidence","title":"Evidence and Review","kind":"evidence","status":"active","sourceRefs":["evidence:parent-issue","github://SocioProphet/prophet-platform/pull/409","github://SocioProphet/ontogenesis/pull/43","review:initial-direction"]},{"panelId":"panel-score","title":"Outcome Score and Learning","kind":"score","status":"planned","sourceRefs":["outcome:orggov-captured","score:orggov-v0-initial","learning:product-compression"]}],"labels":{"program":"orggov-v0","parent":"SocioProphet/prophet-platform#406","workspaceIssue":"SocioProphet/prophet-workspace#15"}}
